[
  {
    "id": "e0412", "match_id": "m001", "t": 2052.4, "period": 1, "type": "pass", "subtype": "through",
    "team": "home", "from": 8, "to": 10,
    "start": [60.1, 30.2], "end": [82.5, 25.0],
    "distance_m": 23.0, "speed_kmh": 64, "duration_s": 1.3, "success": true,
    "source": "cv", "confidence": 0.87
  },
  {
    "id": "e0413", "match_id": "m001", "t": 2054.1, "period": 1, "type": "shot", "subtype": "on_target",
    "team": "home", "from": 10, "to": null,
    "start": [88.0, 30.5], "end": [105.0, 35.1],
    "distance_m": 17.6, "speed_kmh": 108, "success": false,
    "source": "cv", "confidence": 0.91
  },
  {
    "id": "e0414", "match_id": "m001", "t": 2061.0, "period": 1, "type": "foul",
    "team": "away", "from": 105, "to": 10,
    "start": [86.2, 40.0],
    "source": "sim", "confidence": 1.0
  }
]
